cidade,uf,itbi_aliquota,itbi_base_calculo,itbi_isencoes,iss_construcao_aliquota,iss_base_calculo,iss_deducao_materiais,taxa_alvara_valor_m2,taxa_alvara_valor_fixo,taxa_alvara_formula,taxa_habite_se_valor_m2,taxa_habite_se_valor_fixo,taxa_habite_se_formula,taxa_analise_projeto_m2,taxa_aprovacao_projeto,taxa_bombeiros,taxa_vigilancia_sanitaria,taxa_meio_ambiente,codigo_tributario_lei,codigo_obras_lei,plano_diretor_lei,fonte_url,data_atualizacao,observacoes
Florianópolis,SC,2.0,"Valor venal do imóvel ou valor de transação, o que for maior",Primeira aquisição imobiliária pelo SFH até determinado valor; transmissão para empresa de construção para incorporação,3.0,Valor do contrato de prestação de serviços,40.0,,,Baseado em UFM (Unidade Fiscal do Município) x área da construção,,,Baseado em UFM x área da construção,,,,,,Lei Complementar nº 007/1997 e alterações,Lei Complementar nº 060/2000,Lei Complementar nº 482/2014,https://leismunicipais.com.br/codigo-tributario-florianopolis-sc,,Capital do estado. Maior complexidade em aprovações. Consultar SMDU para projetos.
São José,SC,2.0,"Valor venal ou valor declarado na transação, o maior",Imóveis vinculados a programas habitacionais populares,3.0,Preço do serviço,40.0,,,Tabela por faixa de área construída,,,Tabela por faixa de área construída,,,,,,Lei Complementar nº 021/2005,,Lei Complementar nº 001/2014 - Plano Diretor Participativo,https://leismunicipais.com.br/codigo-tributario-sao-jose-sc,,Segunda maior cidade da Grande Florianópolis. Processo de aprovação moderado.
Palhoça,SC,2.0,Valor venal do imóvel,Primeira aquisição de imóvel residencial até determinado valor (verificar lei),3.0,Valor do serviço prestado,40.0,,,Valor por m² conforme tabela anexa ao Código Tributário,,,Valor por m² conforme tabela,,,,,,Lei Complementar nº 235/2017,Lei Complementar nº 336/2020,Lei Complementar nº 399/2022,https://leismunicipais.com.br/codigo-tributario-palhoca-sc,,Cidade em expansão. Processos mais ágeis que Florianópolis.
Biguaçu,SC,2.0,Valor venal ou valor da transação,,3.0,Preço do serviço,40.0,,,Tabela de valores por área,,,Tabela de valores por área,,,,,,Lei Complementar nº 012/2003,Lei Complementar nº 036/2009,Lei Complementar nº 035/2009,https://leismunicipais.com.br/codigo-tributario-biguacu-sc,,Menor complexidade burocrática. Valores mais acessíveis.
Santo Amaro da Imperatriz,SC,2.0,Valor venal do imóvel,,2.0,Valor do serviço,40.0,,,Valor fixo + por m²,,,Valor fixo + por m²,,,,,,Lei Complementar nº 028/2017,Lei nº 1.837/2008,,https://leismunicipais.com.br/codigo-tributario-santo-amaro-da-imperatriz-sc,,Menor município da região. Processos simplificados. ISS mais baixo.
